1.,Общие стоматологические мероприятия (терапевтические; амбулаторно-хирургические; ортопедические; ортодонтические),
1.1.,стоматологические обследования и консультации:,
1.1.1.,осмотр пациента при первичном обращении,9.59
1.1.2.,осмотр пациента при повторном обращении,7.28
1.1.3.,консультация ,12.69
1.1.4.,консультация врача-специалиста стоматологического профиля; имеющего ученую степень; ученое звание,14.86
1.2.,оценка результатов исследований:,
1.2.1.,дентальных рентгенограмм; панорамных (ортопантомограмм); заключений врачей-рентгенологов по проведенным рентгенисследованиям,13.02
1.2.2.,телерентгенограмм; конусно-лучевых компьютерных томограмм (далее – КЛКТ),26.04
1.2.3.,дополнительных методов исследования; медицинского фотографирования; заключений врачей-специалистов,1.35
1.3.,удаление зубных отложений:,
1.3.1.,ручным и/или химическим способом (за один зуб),5.05
1.3.2.,аппаратным методом (пневматическим; ультразвуковым; магнитострикционным и т.п.) (за один зуб),5.89
1.3.3.,с применением содоструйного аппарата (за один зуб),5.96
1.3.4.,покрытие одного зуба фтор- и/или кальцийсодержащим или герметизирующим препаратом,4.49
1.4.,применение местной анестезии на одно вмешательство:,
1.4.1.,аппликационная анестезия ,1.40
1.4.2.,инфильтрационная анестезия ,5.81
1.4.3.,проводниковая анестезия ,7.16
1.4.4.,интралигаментарная анестезия ,5.81
1.5.,наложение временной пломбы,1.60
1.6.,получение оттисков челюстей:,
1.6.1.,из альгинатной массы,4.89
1.6.2.,из силиконовой (независимо от вида); полисилоксановой массы,6.24
1.6.3.,термопластическими композитами,6.24
1.6.4.,оптический слепок (3D-оттиск) за одну челюсть,9.16
1.6.5.,изготовление силиконового ключа,5.43
1.7.,отливка моделей:,
1.7.1.,из гипса,4.34
1.7.2.,из супергипса,4.76
1.7.3.,комбинированной,8.49
1.8.,избирательное пришлифовывание одного зуба,4.23
1.9.,одонтодиагностика одного зуба,2.12
1.10.,забор материала для исследования:,
1.10.1.,трепанбиопсия,44.00
1.10.2.,биопсия (инцизионная; эксцизионная),34.98
1.10.3.,пункционная биопсия,19.75
1.10.4.,забор материала для микробиологического исследования,9.25
1.11.,забор материала для цитологического исследования одним из методов:,7.54
1.11.1.,проведение экспресс-тестирования (методом полимеразной цепной реакции (ПЦР-диагностика) и другими методами экспресс-тестирования),9.42
1.11.2.,проведение функциональных проб (электромиография; миотонометрия),59.88
1.12.,использование системы изоляции в полости рта:,
1.12.1.,с кламмерной системой (за установку системы),20.73
1.12.2.,бескламмерной системой,51.19
1.13.,использование микроскопа при лечении (дополнительно к объему выполненной работы),2.44
1.14.,использование оптических систем (бинокулярные лупы и другое) при лечении (дополнительно к объему выполненной работы),1.67
1.15.,медицинское фотографирование,18.83
1.16.,удаление одной пломбы; трепанация одной искусственной коронки,7.64
1.17.,ретракция десны одного зуба,8.02
1.18.,планирование дентальной имплантации на одну челюсть (до 4 имплантатов включительно) с использованием специального программного обеспечения,58.59
1.19.,планирование дентальной имплантации на одну челюсть (более 4 имплантатов) с использованием специального программного обеспечения,78.12
1.20.,моделирование одного хирургического шаблона с использованием специального программного обеспечения (до 4 имплантатов включительно),78.12
1.21.,моделирование одного хирургического шаблона с использованием специального программного обеспечения (более 4 имплантатов) или шаблона для редукции или резекции челюстей,136.71
1.22.,изготовление каппы,66.83
1.23.,извлечение из одного корневого канала штифта; культевой вкладки с использованием ультразвуковой насадки,121.37
1.24.,извлечение из одного корневого канала штифта; культевой вкладки; инородного тела с использованием стоматологического инструмента,62.31
1.25.,применение материалов; инструментов; изделий и средств медицинского назначения при проведении стоматологических мероприятий (терапевтических; амбулаторно- хирургических; ортопедических; ортодонтических):,
1.25.1.,набор инструментов; используемых на терапевтическом приеме,0.29
1.25.2.,набор инструментов; используемых на ортопедическом приеме,0.44
1.25.3.,набор инструментов; используемых на ортодонтическом приеме,0.29
1.25.4.,набор инструментов; используемых на хирургическом приеме,0.28
1.25.5.,набор инструментов для снятия зубных отложений,11.28
1.25.6.,инструмент для костной пластики (набор),1.38
1.25.6.1.,пприменение ножниц хирургических,0.21
1.25.6.2.,применение скальпеля хирургического,1.68
1.25.6.3.,применение скальпеля одноразового,1.49
1.25.6.4.,применение иглодержателя,0.23
1.25.6.5.,применение одного инструмента для разведения краев раны,0.56
1.25.6.6.,применение зажима кровоостанавливающего,0.21
1.25.6.7.,применение элеватора экстракционного хирургического,0.22
1.25.6.8.,применение щипцов для удаления зубов,0.53
1.25.6.9.,применение долота хирургического,0.20
1.25.6.10.,применение для апикальной хирургии финишный,0.69
1.25.6.11.,применение для апикальной хирургии для финишной обработки корневого канала,0.63
1.25.6.12.,применение для апикальной хирургии титановая щетка,1.11
1.25.6.13.,применение для апикальной хирургии K-Reamer,0.21
1.25.6.14.,применение для апикальной хирургии Largo Peeso Reamer,0.25
1.25.6.15.,применение для апикальной хирургии канал-локатор Canal Locator,0.20
1.25.6.16.,применение для апикальной хирургии SC Foshan SOCO Dental Root,0.24
1.25.6.17.,применение для апикальной хирургии Эмалевый нож,0.33
1.25.6.18.,применение для апикальной хирургии XP-ENDO SHAPER ,0.78
1.25.6.19.,применение для апикальной хирургии,0.19
1.25.6.20.,применение для апикальной хирургии,0.19
1.25.6.21.,применение для апикальной хирургии,0.19
1.25.6.22.,применение ложки кюретажной,0.22
1.25.6.23.,применение распатора,0.19
1.25.6.24.,применение мукотома,0.00
1.25.7.,угловой S-Max,1.43
1.25.7.1.,применение стоматологического наконечника углового НУК НУПМ,0.32
1.25.7.2.,применение стоматологического наконечника углового Foshan COXO,0.47
1.25.7.3.,применение стоматологического наконечника углового Dentalwerk Bumroos,1.15
1.25.7.4.,применение стоматологического наконечника прямого НПМ,0.25
1.25.7.5.,применение стоматологического наконечника турбинного S-Max,1.28
1.25.7.6.,применение стоматологического наконечника турбинного высокоскоростной Sunea fusion,1.02
1.25.7.7.,применение стоматологического наконечника турбинного Foshan COXO,0.38
1.25.7.8.,применение стоматологического наконечника SMARTmatic,0.71
1.25.7.9.,применение осциллирующего наконечника высокоскоростной,0.33
1.25.7.10.,применение осциллирующего наконечника PROPHYflex профилактический,2.01
1.25.7.11.,применение осциллирующего наконечника RONDOflex,3.10
1.25.7.12.,применение осциллирующего наконечника,0.15
1.25.8.1.,применение отвертки для формирователя десневой манжетки (далее – ФДМ); фиксирующего винта абатмента; заглушки имплантата,4.81
1.25.8.2.,применение хирургической отвертки,13.35
1.25.8.3.,применение бора твердосплавного NTI,1.56
1.25.8.4.,применение бора твердосплавного Strauss,0.64
1.25.8.5.,применение бора твердосплавного Strauss,0.54
1.25.8.6.,применение бора твердосплавного Predator,1.25
1.25.8.7.,применение бора твердосплавного КМИЗ,0.16
1.25.8.8.,применение бора твердосплавного Германия,3.03
1.25.8.9.,применение бора твердосплавного Lindeman,2.78
1.25.8.10.,применение бора твердосплавного,0.99
1.25.8.11.,применение бора твердосплавного Prima Classic,0.50
1.25.8.12.,применение бора твердосплавного,2.59
1.25.8.13.,применение бора твердосплавного,2.53
1.25.8.14.,применение бора твердосплавного,2.55
1.25.8.15.,применение бора алмазного NTI,0.82
1.25.8.16.,применение бора алмазного NTI,0.62
1.25.8.17.,применение бора алмазного NTI,0.62
1.25.8.18.,применение бора алмазного NTI,0.49
1.25.8.19.,применение бора алмазного NTI,0.62
1.25.8.20.,применение бора алмазного NTI,0.40
1.25.8.21.,применение бора алмазного Strauss,0.38
1.25.8.22.,применение бора алмазного Strauss,0.39
1.25.8.23.,применение бора алмазного Strauss,0.36
1.25.8.24.,применение бора алмазного Система,0.07
1.25.8.25.,применение бора алмазного Алмазные инструменты,0.40
1.25.8.26.,применение бора алмазного Hager & Meisinger,0.82
1.25.8.27.,применение фрезы (хирургической) твердосплавной для распиливания кости; зуба,12.98
1.25.8.28.,применение фрезы (хирургической) костной керамической,1.58
1.25.8.29.,применение трепана,0.04
1.25.8.30.,применение фрезы алмазной для апикоэктомии и разделения зубов,7.28
1.25.8.31.,применение костного сверла,35.04
1.25.8.32.,применение щеточки полировочной NTI,0.11
1.25.8.33.,применение щеточки полировочной ProfiLax,0.36
1.25.8.34.,применение щеточки полировочной Prophy  Occlu Brush,0.27
1.25.8.35.,применение щеточки полировочной Prophy Brush,0.30
1.25.8.36.,применение щеточки полировочной Prophy Brush,0.30
1.25.8.37.,применение щеточки полировочной Hawe Miniature; Чехия,0.30
1.25.8.38.,применение щеточки полировочной,0.22
1.25.8.39.,применение щеточки полировочной,0.00
1.25.8.40.,применение щеточки полировочной,0.00
1.25.8.41.,применение головки полировочной либо головки полировочной одноразовой Superflex,0.86
1.25.8.42.,применение головки полировочной либо головки полировочной одноразовой Полир,6.96
1.25.8.43.,применение головки полировочной либо головки полировочной одноразовой Diarflex Siliflex,2.05
1.25.8.44.,применение головки полировочной либо головки полировочной одноразовой NTI,0.77
1.25.8.45.,применение головки полировочной либо головки полировочной одноразовой,0.76
1.25.8.46.,применение головки полировочной либо головки полировочной одноразовой диск ТОР ВМ,0.72
1.25.8.47.,применение головки полировочной...одноразовой диск Sof-Lex ,0.81
1.25.8.48.,применение головки полировочной...одноразовой диск полир Super-snap,0.77
1.25.9.1.,применение инструментов для костной пластики (из расчета на один инструмент или набор),12.39
1.25.9.2.,применение инструментов для навигационной хирургии (из расчета на один инструмент или набор),12.39
1.25.9.3.,применение инструментов для извлечения винта/имплантата (из расчета на один инструмент или набор),12.39
1.25.9.4.,применение инструментов для планирования имплантации по готовым шаблонам (из расчета на один инструмент или набор),2.46
1.25.9.5.,применение инструментов для профилирования кости (из расчета на один инструмент или набор),12.39
1.25.9.6.,применение инструментов для синус-лифтинга (из расчета на один инструмент или набор),12.39
1.25.9.7.,применение инструментов для установки ортодонтических имплантатов (из расчета на один инструмент или набор),12.39
1.25.9.8.,применение инструментов для направленной костной регенерации (из расчета на один инструмент или набор),12.39
1.25.9.9.,применение сетки и инструментов для направленной костной регенерации,0.63
1.25.9.10.,применение ключа для аттачмента,0.67
1.25.9.11.,применение ключа для аттачмента,0.66
1.25.9.12.,применение ключа для аттачмента,0.53
1.25.9.13.,применение ключа для аттачмента HTD Израиль,0.99
1.25.10.1.,применение динамометрического ключа,7.03
1.25.10.2.,применение отвертки для абатмента,0.56
1.25.11.1.,применение канюли для смешивания слепочных масс,0.61
1.25.11.2.,применение канюли для промывания корневого канала,10.46
1.25.11.3.,применение канюли для смешивания пломбировочных материалов,1.04
1.25.11.4.,применение канюли аспирационной одноразовой нестерильной,4.23
1.25.12.1.,применение ирригационной системы стерильной,0.00
1.25.12.2.,применение канюли аспирационной одноразовой стерильной,5.23
1.25.12.3.,применение слюноотсоса хирургического стерильного,0.08
1.25.12.4.,применение наконечника на слюноотсос одноразового стерильного,0.28
1.25.12.5.,применение наконечника на пылесос одноразового стерильного,0.15
1.25.12.6.,применение салфетки (фартука стоматологического или пеленки) для пациента одноразовой стерильной,0.26
1.25.12.7.,применение марли медицинской стерильной,0.16
1.25.12.8.,применение валиков стоматологических стерильных,0.23
1.25.12.9.,применение марлевых шариков стерильных,0.17
1.25.13.1.,применение ножниц по металлу,0.15
1.25.13.2.,применение щипцов крампонных,0.36
1.25.14.1.,применение фиксирующего винта,37.18
1.25.14.2.,применение фиксирующего винта,37.18
1.25.14.3.,применение фиксирующего винта,36.30
1.25.14.4.,применение фиксирующего винта,47.19
1.25.14.5.,применение фиксирующего винта,35.20
1.25.14.6.,применение фиксирующего винта,31.49
1.25.14.7.,применение фиксирующего винта титановый,33.80
1.25.14.8.,применение фиксирующего винта ортодонтический анкерный Корея,108.69
1.25.15.,применение динамометрического ключа,3.59
1.25.16.1.,применение насадки звуковой для распиливания кости; расщепления костного гребня и отделения зуба от альвеолы,202.45
1.25.16.2,применение насадки хирургической (светодиод) для лазера,0.15
1.25.17.1.,применение наконечника на слюноотсос одноразового нестерильного,0.12
1.25.17.2.,применение наконечника на пылесос одноразового нестерильного,0.00
1.25.18.,применение микроаппликатора,0.07
1.25.19.,применение салфетки (фартука стоматологического или пеленки) для пациента одноразовой нестерильной,1.34
1.25.20.,применение марли медицинской нестерильной,0.01
1.25.21.,применение одного вида асептической повязки стерильной,0.00
1.25.22.,применение маски одноразовой,0.09
1.25.23.,применение перчаток медицинских хирургических стерильных одноразовых; используемых при каждом посещении пациента на хирургическом приеме,3.50
1.25.24.,применение перчаток медицинских одноразовых,0.17
1.25.25.,применение комплекта одежды стерильной хирургической одноразовой,22.44
1.25.26.,применение стакана одноразового,0.03
1.25.27.,применение валиков стоматологических ,0.07
1.25.28.,применение штифта бумажного,0.06
1.25.29.1.,применение атравматического шовного материала ПГА,6.92
1.25.29.2.,применение атравматического шовного материала Даклон,8.49
1.25.29.3.,применение атравматического шовного материала Полиамид,4.88
1.25.29.4.,применение атравматического шовного материала Викрол; Сургикрол,9.13
1.25.29.5.,применение атравматического шовного материала Metric,4.73
1.25.29.6.,применение атравматического шовного материала Кетгут,8.90
1.25.30.,применение дренажа,1.48
1.25.31.,применение артикуляционной бумаги; окклюзионной пластинки,0.80
1.25.32.1.,применение системы адгезивной (один зуб) Adper Single Bond,2.64
1.25.32.2.,применение системы адгезивной (один зуб) OptiBond Universal,3.40
1.25.32.3.,применение системы адгезивной (один зуб) Prime&Bond one etch&rinse,2.20
1.25.32.4.,применение системы адгезивной (один зуб) Дентин кондиционер,0.00
1.25.32.5.,применение системы адгезивной (один зуб) Gluma Bond Universal,10.61
1.25.32.6.,применение системы адгезивной (один зуб) Prime&Bond Universal,5.98
1.25.32.7.,применение системы адгезивной (один зуб) Tokuyama Bond Force,4.64
1.25.32.8.,применение системы адгезивной (один зуб) С-бонд Ceram Bond,3.83
1.25.32.9.,применение системы адгезивной (один зуб) Люксабонд,0.00
1.25.32.10.,применение системы адгезивной (один зуб) G-Bond,4.14
1.25.32.11.,применение системы адгезивной (один зуб) G-aenial Bond,3.00
1.25.32.12.,применение системы адгезивной (один зуб) EsBond,1.39
1.25.32.13.,применение системы адгезивной (один зуб) Dental Adhesive HugeBond,1.60
1.25.32.14.,применение системы адгезивной (один зуб) ONE COAT UNIVERSAL,3.37
1.25.32.15.,применение системы адгезивной (один зуб) Tokuyama shield Force plus,5.60
1.25.32.16.,применение системы адгезивной (один зуб),1.17
1.25.33.,применение средства для протравки эмали (один зуб),0.00
1.25.34.1.,применение штрипсы Бельгия,11.85
1.25.34.2.,применение штрипсы Германия,14.11
1.25.34.3.,применение штрипсы Польша,13.83
1.25.34.4.,применение штрипсы полоска шлифовальная ТОР ВМ,0.09
1.25.34.5.,применение штрипсы Sof-Lex,1.17
1.25.34.6.,применение штрипсы полоска абразивная Drendel Zweilin,15.95
1.25.34.7.,применение штрипсы полоска абразивная,1.53
